{
  "id": "839c9c15930bba2c",
  "user_id": "default",
  "created_at": "2025-11-16T10:22:47.762635",
  "state": {},
  "research_history": [
    {
      "topic": "chat gpt",
      "type": "News",
      "timestamp": "2025-11-16 10:23:07",
      "search_results": [
        {
          "title": "ChatGPT",
          "url": "https://chatgpt.com/",
          "snippet": "ChatGPTis your AI chatbot for everyday use.Chatwith the most advanced AI to explore ideas, solve problems, and learn faster.",
          "source": "DuckDuckGo"
        },
        {
          "title": "Introducing ChatGPT - OpenAI",
          "url": "https://openai.com/index/chatgpt/",
          "snippet": "We've trained a model calledChatGPTwhich interacts in a conversational way. The dialogue format makes it possible forChatGPTto answer followup questions, admit its mistakes, challenge incorrect premises, and reject inappropriate requests.",
          "source": "DuckDuckGo"
        },
        {
          "title": "ChatGPT - Apps on Google Play",
          "url": "https://play.google.com/store/apps/details?id=com.openai.chatgpt&hl=en-US",
          "snippet": "ChatGPTis a free app that lets you create and transform images, have conversations, and get advice from OpenAI's latest models. You can also upload photos, find creative ideas, and get instant answers withChatGPT.",
          "source": "DuckDuckGo"
        },
        {
          "title": "ChatGPT - Wikipedia",
          "url": "https://en.wikipedia.org/wiki/ChatGPT",
          "snippet": "ChatGPTis a generative artificial intelligence chatbot developed by OpenAI and released in November 2022. It currently uses GPT-5, a generative pre-trained transformer (GPT), to generate text, speech, and images in response to user prompts. [3][4] It is credited with accelerating the AI boom, an ongoing period marked by rapid investment and public attention toward the field of artificial ...",
          "source": "DuckDuckGo"
        },
        {
          "title": "ChatGPT | AI Chatbot to Discover, Learn & Create",
          "url": "https://chatgpt.com/overview",
          "snippet": "ChatGPTis the free AI chatbot for everyone. Ask anything, learn, and explore new ideas with the world's most advanced AIchat.",
          "source": "DuckDuckGo"
        }
      ],
      "summary": "ChatGPTis your AI chatbot for everyday use Chatwith the most advanced AI to explore ideas, solve problems, and learn faster Weve trained a model calledChatGPTwhich interacts in a conversational way ChatGPTis a free app that lets you create and transform images, have conversations, and get advice from OpenAIs latest models ChatGPTis a generative artificial intelligence chatbot developed by OpenAI and released in November 2022",
      "report": "\n# Research Report: chat gpt\n\n**Generated:** 2025-11-16 10:23:07\n\n---\n\n## Executive Summary\n\nChatGPTis your AI chatbot for everyday use Chatwith the most advanced AI to explore ideas, solve problems, and learn faster Weve trained a model calledChatGPTwhich interacts in a conversational way ChatGPTis a free app that lets you create and transform images, have conversations, and get advice from OpenAIs latest models ChatGPTis a generative artificial intelligence chatbot developed by OpenAI and released in November 2022\n\n---\n\n## Key Findings\n\n**1. ChatGPT**\n\nChatGPTis your AI chatbot for everyday use.Chatwith the most advanced AI to explore ideas, solve problems, and learn faster.\n\n**2. Introducing ChatGPT - OpenAI**\n\nWe've trained a model calledChatGPTwhich interacts in a conversational way. The dialogue format makes it possible forChatGPTto answer followup questions, admit its mistakes, challenge incorrect premises, and reject inappropriate requests.\n\n**3. ChatGPT - Apps on Google Play**\n\nChatGPTis a free app that lets you create and transform images, have conversations, and get advice from OpenAI's latest models. You can also upload photos, find creative ideas, and get instant answers withChatGPT.\n\n**4. ChatGPT - Wikipedia**\n\nChatGPTis a generative artificial intelligence chatbot developed by OpenAI and released in November 2022. It currently uses GPT-5, a generative pre-trained transformer (GPT), to generate text, speech, and images in response to user prompts. [3][4] It is credited with accelerating the AI boom, an ongoing period marked by rapid investment and public attention toward the field of artificial ...\n\n**5. ChatGPT | AI Chatbot to Discover, Learn & Create**\n\nChatGPTis the free AI chatbot for everyone. Ask anything, learn, and explore new ideas with the world's most advanced AIchat.\n\n---\n\n## Detailed Analysis\n\n### Overview\n\nThis analysis examines chat gpt based on information gathered from 5 sources.\n\n### Information from Sources\n\n**Source 1 (DuckDuckGo):**\n\nChatGPTis your AI chatbot for everyday use.Chatwith the most advanced AI to explore ideas, solve problems, and learn faster.\n\n**Source 2 (DuckDuckGo):**\n\nWe've trained a model calledChatGPTwhich interacts in a conversational way. The dialogue format makes it possible forChatGPTto answer followup questions, admit its mistakes, challenge incorrect premises, and reject inappropriate requests.\n\n**Source 3 (DuckDuckGo):**\n\nChatGPTis a free app that lets you create and transform images, have conversations, and get advice from OpenAI's latest models. You can also upload photos, find creative ideas, and get instant answers withChatGPT.\n\n**Source 4 (DuckDuckGo):**\n\nChatGPTis a generative artificial intelligence chatbot developed by OpenAI and released in November 2022. It currently uses GPT-5, a generative pre-trained transformer (GPT), to generate text, speech, and images in response to user prompts. [3][4] It is credited with accelerating the AI boom, an ongoing period marked by rapid investment and public attention toward the field of artificial ...\n\n**Source 5 (DuckDuckGo):**\n\nChatGPTis the free AI chatbot for everyone. Ask anything, learn, and explore new ideas with the world's most advanced AIchat.\n\n\n### Synthesis\n\nBased on the gathered information, chat gpt is a subject of significant interest with multiple perspectives and findings. \nThe sources provide various insights that contribute to a comprehensive understanding of this topic.\n\n---\n\n## Sources and References\n\n[1] \"ChatGPT,\" *DuckDuckGo*. [Online]. Available: https://chatgpt.com/\n\n[2] \"Introducing ChatGPT - OpenAI,\" *DuckDuckGo*. [Online]. Available: https://openai.com/index/chatgpt/\n\n[3] \"ChatGPT - Apps on Google Play,\" *DuckDuckGo*. [Online]. Available: https://play.google.com/store/apps/details?id=com.openai.chatgpt&hl=en-US\n\n[4] \"ChatGPT - Wikipedia,\" *DuckDuckGo*. [Online]. Available: https://en.wikipedia.org/wiki/ChatGPT\n\n[5] \"ChatGPT | AI Chatbot to Discover, Learn & Create,\" *DuckDuckGo*. [Online]. Available: https://chatgpt.com/overview\n\n---\n\n## Conclusion\n\nThis research report on chat gpt has compiled information from 5 sources. \nThe findings provide valuable insights into this subject matter. \n\n### Key Takeaways:\n\n- Multiple sources confirm the relevance and importance of chat gpt\n- The information gathered represents diverse perspectives and data points\n- Further research may be beneficial for deeper understanding\n\n### Recommendations:\n\nFor those interested in exploring this topic further, we recommend:\n- Reviewing the cited sources in detail\n- Conducting follow-up research on specific aspects of interest\n- Staying updated with new developments in this field\n\nThis report serves as a comprehensive starting point for understanding chat gpt and can be used as a foundation for further investigation.\n\n---\n\n*Report generated by AI Research Assistant*\n",
      "trace_id": "trace_1763268785147",
      "settings": {
        "max_results": 5,
        "summary_length": "Medium",
        "deep_analysis": true
      }
    }
  ],
  "context": [
    {
      "content": "Searched for: chat gpt",
      "timestamp": "2025-11-16T10:23:07.330277"
    }
  ]
}